{
  "schemaVersion": "pcs-analysis-snapshot-v2",
  "snapshotId": "snapshot_fixture_v2_20260713",
  "profileId": "profile_fixture",
  "generatedAt": "2026-07-13T00:00:00.000Z",
  "period": {
    "startAt": "2026-07-01T00:00:00.000Z",
    "endAt": "2026-07-13T00:00:00.000Z",
    "timezone": "Asia/Tokyo"
  },
  "records": [
    {
      "id": "pcs_record_01",
      "recordedAt": "2026-07-01T09:00:00.000Z",
      "title": "Record 01",
      "sourceDocumentId": "doc_01",
      "values": [
        {
          "fieldKey": "task_clarity",
          "label": "Task clarity",
          "valueType": "scale",
          "value": 2,
          "templateId": "daily-work",
          "templateVersionId": "daily-work-v1",
          "analysisRole": "task_clarity",
          "analysisRoleConfirmed": true,
          "analysisUsage": "condition",
          "analysisMergeAllowed": true,
          "scaleFingerprint": "scale-0-5",
          "minimum": 0,
          "maximum": 5,
          "provenance": {
            "source": "user_input",
            "sourceId": "value_clarity_01",
            "userConfirmed": true,
            "recordedAt": "2026-07-01T09:00:00.000Z",
            "transformVersion": "pcs-v2-fixture",
            "privacyLevel": "normal"
          }
        },
        {
          "fieldKey": "start_delay",
          "label": "Start delay",
          "valueType": "duration_minutes",
          "value": 40,
          "templateId": "daily-work",
          "templateVersionId": "daily-work-v1",
          "analysisRole": "start_delay",
          "analysisRoleConfirmed": true,
          "analysisUsage": "outcome",
          "analysisMergeAllowed": true,
          "scaleFingerprint": "minutes-0-60",
          "unit": "minutes",
          "minimum": 0,
          "maximum": 60,
          "provenance": {
            "source": "user_input",
            "sourceId": "value_delay_01",
            "userConfirmed": true,
            "recordedAt": "2026-07-01T09:00:00.000Z",
            "transformVersion": "pcs-v2-fixture",
            "privacyLevel": "normal"
          }
        }
      ]
    },
    {
      "id": "pcs_record_02",
      "recordedAt": "2026-07-02T09:00:00.000Z",
      "title": "Record 02",
      "sourceDocumentId": "doc_02",
      "values": [
        {
          "fieldKey": "task_clarity",
          "label": "Task clarity",
          "valueType": "scale",
          "value": 2,
          "templateId": "daily-work",
          "templateVersionId": "daily-work-v1",
          "analysisRole": "task_clarity",
          "analysisRoleConfirmed": true,
          "analysisUsage": "condition",
          "analysisMergeAllowed": true,
          "scaleFingerprint": "scale-0-5",
          "minimum": 0,
          "maximum": 5,
          "provenance": {
            "source": "user_input",
            "sourceId": "value_clarity_02",
            "userConfirmed": true,
            "recordedAt": "2026-07-02T09:00:00.000Z",
            "transformVersion": "pcs-v2-fixture",
            "privacyLevel": "normal"
          }
        },
        {
          "fieldKey": "start_delay",
          "label": "Start delay",
          "valueType": "duration_minutes",
          "value": 40,
          "templateId": "daily-work",
          "templateVersionId": "daily-work-v1",
          "analysisRole": "start_delay",
          "analysisRoleConfirmed": true,
          "analysisUsage": "outcome",
          "analysisMergeAllowed": true,
          "scaleFingerprint": "minutes-0-60",
          "unit": "minutes",
          "minimum": 0,
          "maximum": 60,
          "provenance": {
            "source": "user_input",
            "sourceId": "value_delay_02",
            "userConfirmed": true,
            "recordedAt": "2026-07-02T09:00:00.000Z",
            "transformVersion": "pcs-v2-fixture",
            "privacyLevel": "normal"
          }
        }
      ]
    },
    {
      "id": "pcs_record_03",
      "recordedAt": "2026-07-03T09:00:00.000Z",
      "title": "Record 03",
      "sourceDocumentId": "doc_03",
      "values": [
        {
          "fieldKey": "task_clarity",
          "label": "Task clarity",
          "valueType": "scale",
          "value": 2,
          "templateId": "daily-work",
          "templateVersionId": "daily-work-v1",
          "analysisRole": "task_clarity",
          "analysisRoleConfirmed": true,
          "analysisUsage": "condition",
          "analysisMergeAllowed": true,
          "scaleFingerprint": "scale-0-5",
          "minimum": 0,
          "maximum": 5,
          "provenance": {
            "source": "user_input",
            "sourceId": "value_clarity_03",
            "userConfirmed": true,
            "recordedAt": "2026-07-03T09:00:00.000Z",
            "transformVersion": "pcs-v2-fixture",
            "privacyLevel": "normal"
          }
        },
        {
          "fieldKey": "start_delay",
          "label": "Start delay",
          "valueType": "duration_minutes",
          "value": 40,
          "templateId": "daily-work",
          "templateVersionId": "daily-work-v1",
          "analysisRole": "start_delay",
          "analysisRoleConfirmed": true,
          "analysisUsage": "outcome",
          "analysisMergeAllowed": true,
          "scaleFingerprint": "minutes-0-60",
          "unit": "minutes",
          "minimum": 0,
          "maximum": 60,
          "provenance": {
            "source": "user_input",
            "sourceId": "value_delay_03",
            "userConfirmed": true,
            "recordedAt": "2026-07-03T09:00:00.000Z",
            "transformVersion": "pcs-v2-fixture",
            "privacyLevel": "normal"
          }
        }
      ]
    },
    {
      "id": "pcs_record_04",
      "recordedAt": "2026-07-04T09:00:00.000Z",
      "title": "Record 04",
      "sourceDocumentId": "doc_04",
      "values": [
        {
          "fieldKey": "task_clarity",
          "label": "Task clarity",
          "valueType": "scale",
          "value": 2,
          "templateId": "daily-work",
          "templateVersionId": "daily-work-v1",
          "analysisRole": "task_clarity",
          "analysisRoleConfirmed": true,
          "analysisUsage": "condition",
          "analysisMergeAllowed": true,
          "scaleFingerprint": "scale-0-5",
          "minimum": 0,
          "maximum": 5,
          "provenance": {
            "source": "user_input",
            "sourceId": "value_clarity_04",
            "userConfirmed": true,
            "recordedAt": "2026-07-04T09:00:00.000Z",
            "transformVersion": "pcs-v2-fixture",
            "privacyLevel": "normal"
          }
        },
        {
          "fieldKey": "start_delay",
          "label": "Start delay",
          "valueType": "duration_minutes",
          "value": 40,
          "templateId": "daily-work",
          "templateVersionId": "daily-work-v1",
          "analysisRole": "start_delay",
          "analysisRoleConfirmed": true,
          "analysisUsage": "outcome",
          "analysisMergeAllowed": true,
          "scaleFingerprint": "minutes-0-60",
          "unit": "minutes",
          "minimum": 0,
          "maximum": 60,
          "provenance": {
            "source": "user_input",
            "sourceId": "value_delay_04",
            "userConfirmed": true,
            "recordedAt": "2026-07-04T09:00:00.000Z",
            "transformVersion": "pcs-v2-fixture",
            "privacyLevel": "normal"
          }
        }
      ]
    },
    {
      "id": "pcs_record_05",
      "recordedAt": "2026-07-05T09:00:00.000Z",
      "title": "Record 05",
      "sourceDocumentId": "doc_05",
      "values": [
        {
          "fieldKey": "task_clarity",
          "label": "Task clarity",
          "valueType": "scale",
          "value": 2,
          "templateId": "daily-work",
          "templateVersionId": "daily-work-v1",
          "analysisRole": "task_clarity",
          "analysisRoleConfirmed": true,
          "analysisUsage": "condition",
          "analysisMergeAllowed": true,
          "scaleFingerprint": "scale-0-5",
          "minimum": 0,
          "maximum": 5,
          "provenance": {
            "source": "user_input",
            "sourceId": "value_clarity_05",
            "userConfirmed": true,
            "recordedAt": "2026-07-05T09:00:00.000Z",
            "transformVersion": "pcs-v2-fixture",
            "privacyLevel": "normal"
          }
        },
        {
          "fieldKey": "start_delay",
          "label": "Start delay",
          "valueType": "duration_minutes",
          "value": 40,
          "templateId": "daily-work",
          "templateVersionId": "daily-work-v1",
          "analysisRole": "start_delay",
          "analysisRoleConfirmed": true,
          "analysisUsage": "outcome",
          "analysisMergeAllowed": true,
          "scaleFingerprint": "minutes-0-60",
          "unit": "minutes",
          "minimum": 0,
          "maximum": 60,
          "provenance": {
            "source": "user_input",
            "sourceId": "value_delay_05",
            "userConfirmed": true,
            "recordedAt": "2026-07-05T09:00:00.000Z",
            "transformVersion": "pcs-v2-fixture",
            "privacyLevel": "normal"
          }
        }
      ]
    },
    {
      "id": "pcs_record_06",
      "recordedAt": "2026-07-06T09:00:00.000Z",
      "title": "Record 06",
      "sourceDocumentId": "doc_06",
      "values": [
        {
          "fieldKey": "task_clarity",
          "label": "Task clarity",
          "valueType": "scale",
          "value": 2,
          "templateId": "daily-work",
          "templateVersionId": "daily-work-v1",
          "analysisRole": "task_clarity",
          "analysisRoleConfirmed": true,
          "analysisUsage": "condition",
          "analysisMergeAllowed": true,
          "scaleFingerprint": "scale-0-5",
          "minimum": 0,
          "maximum": 5,
          "provenance": {
            "source": "user_input",
            "sourceId": "value_clarity_06",